{
  "$schema": "https://json-schema.org/draft/2020-12/schema",
  "$id": "https://hdip.dev/schemas/audit/audit-record.schema.json",
  "title": "AuditRecord",
  "type": "object",
  "additionalProperties": false,
  "required": [
    "auditId",
    "actor",
    "action",
    "resourceType",
    "resourceId",
    "requestId",
    "outcome",
    "occurredAt",
    "serviceName"
  ],
  "properties": {
    "auditId": {
      "type": "string",
      "minLength": 1
    },
    "actor": {
      "type": "object",
      "additionalProperties": false,
      "required": [
        "principalId",
        "organizationId",
        "actorType",
        "authenticationReference"
      ],
      "properties": {
        "principalId": {
          "type": "string",
          "minLength": 1
        },
        "organizationId": {
          "type": "string",
          "minLength": 1
        },
        "actorType": {
          "type": "string",
          "enum": [
            "issuer_operator",
            "verifier_integrator"
          ]
        },
        "authenticationReference": {
          "type": "string",
          "minLength": 1
        }
      }
    },
    "action": {
      "type": "string",
      "minLength": 1
    },
    "resourceType": {
      "type": "string",
      "minLength": 1
    },
    "resourceId": {
      "type": "string",
      "minLength": 1
    },
    "requestId": {
      "type": "string",
      "minLength": 1
    },
    "idempotencyKey": {
      "type": "string",
      "minLength": 1
    },
    "outcome": {
      "type": "string",
      "enum": [
        "succeeded",
        "denied",
        "failed"
      ]
    },
    "occurredAt": {
      "type": "string",
      "format": "date-time"
    },
    "serviceName": {
      "type": "string",
      "minLength": 1
    }
  }
}
